{
  "schemaVersion": "1.0.0",
  "id": "command_download_binary",
  "type": "command",
  "description": "Download a tool-specific binary and compose CLI arguments from option mappings.",
  "implementation": "pyqa.tooling.strategies.command_download_binary",
  "config": {
    "version": {
      "type": "string",
      "description": "Optional version string passed to the download helper.",
      "required": false
    },
    "download": {
      "type": "object",
      "description": "Download specification describing platform-specific tool assets.",
      "required": true
    },
    "base": {
      "type": "array",
      "description": "Static command arguments (use ${binary} to reference the downloaded binary).",
      "required": false
    },
    "binaryPlaceholder": {
      "type": "string",
      "description": "Token within base arguments replaced by the resolved binary path.",
      "required": false
    },
    "options": {
      "type": "array",
      "description": "List of option mappings translating settings into CLI flags.",
      "required": false
    },
    "targets": {
      "type": "object",
      "description": "Optional target selection rules for appending file or directory arguments.",
      "required": false
    }
  }
}
